,0,1,2,3
0,Mã ngành: KT01,Tên ngành: Cơ khí - cơ điện tử - nhiệt lạnh,Tổ hợp môn:,NV1: 19.50
1,Mã ngành: KT02,Tên ngành: Điện - TĐH - Điện tử - CNTT - Toán tin,Tổ hợp môn:,NV1: 21.50
2,Mã ngành: KT03,Tên ngành: Hóa - Sinh- Thực phẩm - Môi trường,Tổ hợp môn:,NV1: 18.50
3,Mã ngành: KT04,Tên ngành: Vật liệu - Dệt may - Sư phạm kỹ thuật,Tổ hợp môn:,NV1: 18.00
4,Mã ngành: KT05,Tên ngành: Vật lý kỹ thuật- Kỹ thuật hạt nhân,Tổ hợp môn:,NV1: 18.50
5,Mã ngành: KT06,Tên ngành: Kinh tế và quản lý,Tổ hợp môn:,NV1: 20.00
6,Mã ngành: TA1,Tên ngành: Tiếng Anh khoa học kỹ thuật và công nghệ,Tổ hợp môn:,NV1: 26.00
7,Mã ngành: TA2,Tên ngành: Tiếng Anh chuyên nghiệp quốc tế (IPE),Tổ hợp môn:,NV1: 24.00
