,0,1,2,3
0,Mã ngành: 7720101,Tên ngành: Y đa khoa,Tổ hợp môn:,NV1: 23.25
1,Mã ngành: 7720110,Tên ngành: Y học dự phòng,Tổ hợp môn:,NV1: 18.15
2,Mã ngành: 7720115,Tên ngành: Y học cổ truyền,Tổ hợp môn:,NV1: 20.25
3,Mã ngành: 7720201,Tên ngành: Y học cổ truyền,Tổ hợp môn:,NV1: 20.75
4,Mã ngành: 7720301,Tên ngành: Y tế công cộng,Tổ hợp môn:,NV1: 18.15
5,Mã ngành: 7720501,Tên ngành: Điều dưỡng,Tổ hợp môn:,NV1: 22.75
6,Mã ngành: 7720601,Tên ngành: Răng - Hàm - Mặt,Tổ hợp môn:,NV1: 19.25
7,Mã ngành: 7720602,Tên ngành: Kỹ thuật hình ảnh y học,Tổ hợp môn:,NV1: 18.50
8,Mã ngành: 7720701,Tên ngành: Y tế công cộng,Tổ hợp môn:,NV1: 16.15
