,0,1,2,3
0,Mã ngành: 7720101,Tên ngành: Y Khoa,Tổ hợp môn: B00,NV1: 25.00
1,Mã ngành: 7720110,Tên ngành: Y học dự phòng,Tổ hợp môn: B00,NV1: 18.25
2,Mã ngành: 7720115,Tên ngành: Y học cổ truyền,Tổ hợp môn: B00,NV1: 21.75
3,Mã ngành: 7720201,Tên ngành: Dược học,Tổ hợp môn: A00,NV1: 22.75
4,Mã ngành: 7720301,Tên ngành: Điều dưỡng,Tổ hợp môn: B00,NV1: 19.25
5,Mã ngành: 7720501,Tên ngành: Răng - Hàm - Mặt,Tổ hợp môn: B00,NV1: 24.70
6,Mã ngành: 7720601,Tên ngành: Kỹ thuật xét nghiệm y học,Tổ hợp môn: B00,NV1: 21.25
7,Mã ngành: 7720602,Tên ngành: Kỹ thuật hình ảnh y học,Tổ hợp môn: B00,NV1: 20.25
8,Mã ngành: 7720701,Tên ngành: Y tế công cộng,Tổ hợp môn: B00,NV1: 16.50
