,0,1,2,3
0,Mã ngành: 7340101,Tên ngành: Quản trị kinh doanh,"Tổ hợp môn: A00,A01,A16,D01",NV1: 15.00
1,Mã ngành: 7340120,Tên ngành: Kinh doanh quốc tế,"Tổ hợp môn: A00,A01,A16,D01",NV1: 15.00
2,Mã ngành: 7340201,Tên ngành: Tài chính – Ngân hàng,"Tổ hợp môn: A00,A01,A16,D01",NV1: 15.00
3,Mã ngành: 7340301,Tên ngành: Kế toán,"Tổ hợp môn: A00,A01,A16,D01",NV1: 15.00
4,Mã ngành: 7340302,Tên ngành: Kiểm toán,"Tổ hợp môn: A00,A01,A16,D01",NV1: 15.00
5,Mã ngành: 7380107,Tên ngành: Luật kinh tế,"Tổ hợp môn: A00,C00,C15,D01",NV1: 15.00
