,0,1,2,3
0,Mã ngành: 7720330,Tên ngành: Kỹ thuật Hình ảnh Y học,Tổ hợp môn:,NV1: 18.00
1,Mã ngành: 7720332,Tên ngành: Kỹ thuật Xét nghiệm Y học,Tổ hợp môn:,NV1: 18.50
2,Mã ngành: 7720333,Tên ngành: Kỹ thuật Vật lý trị liệu,Tổ hợp môn:,NV1: 17.00
3,Mã ngành: 7720501,Tên ngành: Điều dưỡng,Tổ hợp môn:,NV1: 17.00
4,Mã ngành: C720330,Tên ngành: Cao đẳng Kỹ thuật Hình ảnh Y học,Tổ hợp môn:,NV1: 14.50
5,Mã ngành: C720332,Tên ngành: Cao đẳng Kỹ thuật Xét nghiệm Đa khoa,Tổ hợp môn:,NV1: 15.00
6,Mã ngành: C720333,Tên ngành: Cao đẳng Kỹ thuật Vật Lý trị liệu / PHCN,Tổ hợp môn:,NV1: 13.50
7,Mã ngành: C720501,Tên ngành: Cao đẳng Điều dưỡng,Tổ hợp môn:,NV1: 14.00
8,Mã ngành: C720502,Tên ngành: Cao đẳng Hộ Sinh,Tổ hợp môn:,NV1: 13.00
