,0,1,2,3
0,Mã ngành: 7340101,Tên ngành: Quản trị kinh doanh,Tổ hợp môn:,NV1: 13.00
1,Mã ngành: 7340301,"Tên ngành: Kế toán (gồm các chuyên ngành:Kế toán doanh nghiệp, Kế toán tổng hợp).",Tổ hợp môn:,NV1: 13.00
2,Mã ngành: C340101,Tên ngành: ngành Quản trị kinh doanh (chuyên ngành : Quản trị doanh nghiệp),Tổ hợp môn:,NV1: 10.00
3,Mã ngành: C340201,"Tên ngành: ngành Tài chính - Ngân hàng (chuyên ngành: Kế toán Ngân hàng, Ngân hàng thương mại)",Tổ hợp môn:,NV1: 10.00
4,Mã ngành: C340301,"Tên ngành: ngành Kế toán (gồm các chuyên ngành:Kế toán doanh nghiệp, Kế toán tổng hợp, Kế toán công)",Tổ hợp môn:,NV1: 10.00
5,Mã ngành: C380201,Tên ngành: ngành Dịch vụ pháp lý,Tổ hợp môn:,NV1: 10.00
6,Mã ngành: C510201,Tên ngành: ngành công nghệ kỹ thuật cơ khí,Tổ hợp môn:,NV1: 10.00
