,0,1,2,3
0,Mã ngành: 7140214,Tên ngành: Sư phạm kỹ thuật công nghiệp,Tổ hợp môn:,NV1: 13.00
1,Mã ngành: 7510604,Tên ngành: Kinh tế công nghiệp,Tổ hợp môn:,NV1: 13.00
2,Mã ngành: 7520103,Tên ngành: Kỹ thuật cơ khí,Tổ hợp môn:,NV1: 13.50
3,Mã ngành: 7520114,Tên ngành: Kỹ thuật cơ - điện tử,Tổ hợp môn:,NV1: 13.00
4,Mã ngành: 7520201,"Tên ngành: Kỹ thuật điện, điện tử",Tổ hợp môn:,NV1: 13.00
5,Mã ngành: 7520207,"Tên ngành: Kỹ thuật điện tử, truyền thông",Tổ hợp môn:,NV1: 13.00
6,Mã ngành: 7520214,Tên ngành: Kỹ thuật máy tính,Tổ hợp môn:,NV1: 13.00
7,Mã ngành: 7520216,Tên ngành: Kỹ thuật điều khiển và tự động hóa,Tổ hợp môn:,NV1: 13.00
8,Mã ngành: 7520309,Tên ngành: Kỹ thuật vật liệu,Tổ hợp môn:,NV1: 13.00
