,0,1,2,3
0,Mã ngành: 401,Tên ngành: Kinh tế quốc tế,Tổ hợp môn:,NV1: 21.50
1,Mã ngành: 501,Tên ngành: Luật quốc tế,Tổ hợp môn:,NV1: 19.00
2,Mã ngành: 501,Tên ngành: Luật quốc tế,Tổ hợp môn:,NV1: 19.00
3,Mã ngành: 701,Tên ngành: Tiếng Anh,Tổ hợp môn:,NV1: 21.00
4,Mã ngành: 702,Tên ngành: Tiếng Pháp,Tổ hợp môn:,NV1: 19.00
5,Mã ngành: 704,Tên ngành: Tiếng Trung,Tổ hợp môn:,NV1: 20.00
6,Mã ngành: 705,Tên ngành: Truyền thông Quốc tế,Tổ hợp môn:,NV1: 19.00
7,Mã ngành: 751,Tên ngành: Cử nhân tiếng Anh,Tổ hợp môn:,NV1: 25.00
8,Mã ngành: 753,Tên ngành: Cử nhân tiếng Pháp,Tổ hợp môn:,NV1: 25.00
