,0,1,2,3
0,Mã ngành: 401,Tên ngành: Kinh tế quốc tế,Tổ hợp môn:,NV1: 20.00
1,Mã ngành: 501,Tên ngành: Luật Quốc tế,Tổ hợp môn:,NV1: 19.00
2,Mã ngành: 701,Tên ngành: Tiếng Anh,Tổ hợp môn:,NV1: 21.00
3,Mã ngành: 703,Tên ngành: Tiếng Pháp,Tổ hợp môn:,NV1: 19.00
4,Mã ngành: 704,Tên ngành: Tiếng Trung,Tổ hợp môn:,NV1: 19.00
5,Mã ngành: 705,Tên ngành: Truyền thông quốc tế,Tổ hợp môn:,NV1: 20.50
6,Mã ngành: 751,Tên ngành: Ngôn ngữ Anh,Tổ hợp môn:,NV1: 25.00
7,Mã ngành: 753,Tên ngành: Ngôn ngữ Pháp,Tổ hợp môn:,NV1: 25.00
