,0,1,2,3
0,Mã ngành: 801,Tên ngành: Trang trí nội ngoại thất,Tổ hợp môn:,NV1: 32.00
1,Mã ngành: 802,Tên ngành: Hội họa,Tổ hợp môn:,NV1: 29.00
2,Mã ngành: 803,Tên ngành: Điêu khắc,Tổ hợp môn:,NV1: 29.00
3,Mã ngành: 804,Tên ngành: Thời trang,Tổ hợp môn:,NV1: 30.50
4,Mã ngành: 805,Tên ngành: Sơn mài,Tổ hợp môn:,NV1: 29.00
5,Mã ngành: 806,Tên ngành: Gốm,Tổ hợp môn:,NV1: 29.00
6,Mã ngành: 807,Tên ngành: Đồ họa,Tổ hợp môn:,NV1: 30.50
7,Mã ngành: 808,Tên ngành: Thiết kế công nghiệp,Tổ hợp môn:,NV1: 29.00
