,0,1,2,3
0,Mã ngành: 7720101,Tên ngành: Y Đa khoa,Tổ hợp môn:,NV1: 27.75
1,Mã ngành: 7720201,Tên ngành: Y học cổ truyền,Tổ hợp môn:,NV1: 25.00
2,Mã ngành: 7720301,Tên ngành: Y tế Công cộng,Tổ hợp môn:,NV1: 23.00
3,Mã ngành: 7720302,Tên ngành: Y học Dự phòng,Tổ hợp môn:,NV1: 24.00
4,Mã ngành: 7720303,Tên ngành: Dinh Dưỡng,Tổ hợp môn:,NV1: 23.00
5,Mã ngành: 7720332,Tên ngành: Xét nghiệm Y học,Tổ hợp môn:,NV1: 24.25
6,Mã ngành: 7720501,Tên ngành: Điều Dưỡng,Tổ hợp môn:,NV1: 24.00
7,Mã ngành: 7720601,Tên ngành: Răng Hàm Mặt,Tổ hợp môn:,NV1: 27.00
8,Mã ngành: CNKXNK,Tên ngành: Khúc xạ Nhãn khoa,Tổ hợp môn:,NV1: 23.75
