,0,1,2,3
0,Mã ngành: 7210203,Tên ngành: Sáng tác âm nhạc,Tổ hợp môn:,NV1: 25.50
1,Mã ngành: 7210205,Tên ngành: Thanh nhạc,Tổ hợp môn:,NV1: 28.00
2,Mã ngành: 7210207,Tên ngành: Biểu diễn nhạc cụ phương Tây,Tổ hợp môn:,NV1: 27.50
3,Mã ngành: 7210210,Tên ngành: Biểu diễn nhạc cụ truyền thống,Tổ hợp môn:,NV1: 29.00
4,Mã ngành: 7210210,Tên ngành: Biểu diễn nhạc cụ truyền thống,Tổ hợp môn:,NV1: 29.00
5,Mã ngành: 7210243,Tên ngành: Biên đạo múa,Tổ hợp môn:,NV1: 31.00
6,Mã ngành: 7210244,Tên ngành: Huấn luyện múa,Tổ hợp môn:,NV1: 30.00
7,Mã ngành: 7220342,Tên ngành: Quản lý văn hóa,Tổ hợp môn:,NV1: 21.00
8,Mã ngành: 7320101,Tên ngành: Báo chí,Tổ hợp môn:,NV1: 16.00
